{
  "onStart": "setup"
, "onIterate": "go"
, "roles":
  [
    {
      "name": "student"
    , "limit": -1
    , "widgets": [
        { "type": "hnwMonitor", "display": "Sick?", "source": "sick?-str", "precision": 0, "fontSize": 10 }
      , { "type": "hnwMonitor", "display": "Located at:", "source": "located-at", "precision": 0, "fontSize": 10 }
      , { "type": "hnwMonitor", "display": "You are a:", "source": "description", "precision": 0, "fontSize": 10 }
      , { "type": "hnwSlider", "display": "step-size", "hnwVariable": "step-size", "hnwMin": "1", "hnwMax": "5", "hnwDefault": 1, "units": "", "direction": "horizontal", "hnwStep": "1" }
      , { "type": "hnwButton", "display": "Up", "hnwSource": "move-up", "forever": false, "disableUntilTicksStart": true, "buttonKind": "turtle" }
      , { "type": "hnwButton", "display": "Down", "hnwSource": "move-down", "forever": false, "disableUntilTicksStart": true, "buttonKind": "turtle" }
      , { "type": "hnwButton", "display": "Left", "hnwSource": "move-left", "forever": false, "disableUntilTicksStart": true, "buttonKind": "turtle" }
      , { "type": "hnwButton", "display": "Right", "hnwSource": "move-right", "forever": false, "disableUntilTicksStart": true, "buttonKind": "turtle" }
      , { "type": "hnwButton", "display": "Change Appearance", "hnwSource": "change-appearance", "forever": false, "disableUntilTicksStart": true, "buttonKind": "turtle" }
      , { "type": "hnwView", "height": 400, "width": 400 }
      ]
    , "canJoinMidRun": false
    , "onConnect": "create-new-student"
    , "onDisconnect": "remove-student"
    , "onCursorClick": null
    , "onCursorMove": null
    }
    , {
      "name": "supervisor"
    , "limit": 1
    , "widgets": [
        { "type": "hnwMonitor", "left": 356, "right": 802, "top":  20, "bottom":  65, "display": "Quick Start Instructions- More in Info Window", "hnwSource": "quick-start", "precision": 0, "fontSize": 10 }
      , { "type": "hnwMonitor", "left":  68, "right": 199, "top": 563, "bottom": 608, "display": "Turtles", "hnwSource": "num-turtles", "precision": 0, "fontSize": 10 }
      , { "type": "hnwMonitor", "left": 197, "right": 312, "top": 563, "bottom": 608, "display": "Number sick", "hnwSource": "num-infected", "precision": 0, "fontSize": 10 }
      , { "type": "hnwSlider",  "left": 158, "right": 306, "top": 242, "bottom": 275, "display": "android-delay", "hnwVariable": "android-delay", "hnwMin": "0", "hnwMax": "10", "hnwDefault": 0, "units": "", "direction": "horizontal", "hnwStep": "0.1" }
      , { "type": "hnwSlider",  "left": 157, "right": 304, "top": 133, "bottom": 166, "display": "infection-chance", "hnwVariable": "infection-chance", "hnwMin": "0", "hnwMax": "100", "hnwDefault": 100, "units": "%", "direction": "horizontal", "hnwStep": "1" }
      , { "type": "hnwSlider",  "left": 157, "right": 304, "top":  98, "bottom": 131, "display": "initial-number-sick", "hnwVariable": "initial-number-sick", "hnwMin": "1", "hnwMax": "20", "hnwDefault": 1, "units": "", "direction": "horizontal", "hnwStep": "1" }
      , { "type": "hnwSlider",  "left": 158, "right": 305, "top": 170, "bottom": 203, "display": "number", "hnwVariable": "number", "hnwMin": "1", "hnwMax": "200", "hnwDefault": 5, "units": "androids", "direction": "horizontal", "hnwStep": "1" }
      , { "type": "hnwSwitch",  "left":  43, "right": 155, "top": 115, "bottom": 148, "display": "show-sick?", "hnwVariable": "show-sick?", "on": true }
      , { "type": "hnwSwitch",  "left": 158, "right": 300, "top": 115, "bottom": 148, "display": "show-sick-on-clients?", "hnwVariable": "show-sick-on-clients?", "on": true }
      , { "type": "hnwSwitch",  "left":  43, "right": 155, "top": 259, "bottom": 292, "display": "wander?", "hnwVariable": "wander?", "on": true }
      , { "type": "hnwButton",  "left": 145, "right": 238, "top": 332, "bottom": 365, "display": "clear-plot", "hnwSource": "clear-the-plot", "forever": false, "disableUntilTicksStart": true, "buttonKind": "turtle" }
      , { "type": "hnwButton",  "left":  29, "right": 155, "top": 170, "bottom": 203, "display": "create-androids", "hnwSource": "make-androids", "forever": false, "disableUntilTicksStart": true, "buttonKind": "turtle" }
      , { "type": "hnwButton",  "left":  97, "right": 180, "top":  50, "bottom":  83, "display": "infect", "hnwSource": "infect-turtles", "forever": false, "disableUntilTicksStart": true, "buttonKind": "turtle" }
      , { "type": "hnwButton",  "left": 182, "right": 265, "top":  50, "bottom":  83, "display": "cure-all", "hnwSource": "cure-all", "forever": false, "disableUntilTicksStart": true, "buttonKind": "turtle" }
      , { "type": "hnwButton",  "left": 356, "right": 474, "top":  70, "bottom": 103, "display": "Reset Instructions", "hnwSource": "setup-quick-start", "forever": false, "disableUntilTicksStart": true, "buttonKind": "turtle" }
      , { "type": "hnwButton",  "left": 639, "right": 717, "top":  70, "bottom": 103, "display": "<<< PREV", "hnwSource": "view-prev", "forever": false, "disableUntilTicksStart": true, "buttonKind": "turtle" }
      , { "type": "hnwButton",  "left": 718, "right": 700, "top":  70, "bottom": 103, "display": "NEXT >>>", "hnwSource": "view-next", "forever": false, "disableUntilTicksStart": true, "buttonKind": "turtle" }
      , { "type": "hnwPlot",    "left":  68, "right": 312, "top": 368, "bottom": 565, "display": "Number Sick", "xAxis": "time", "yAxis": "sick", "xmin": 0, "xmax": 25, "ymin": 0, "ymax": 6, "autoPlotOn": true, "legendOn": false, "setupCode": ";; create a temporary plot pen for the current run\r\ncreate-temporary-plot-pen word \"run \" run-number\r\n;; cycle through a few colors so it is easy to\r\n;; differentiate the runs.\r\nset-plot-pen-color item (run-number mod 5) [blue red green orange violet]\r\n;; each run starts with zero infected.\r\nset num-infected-last-plotted 0", "updateCode": "let n count turtles with [infected?] \r\n;; only plot if someone has been infected since the last time we plotted. \r\n;; this smoothes out the plot a bit.\r\nif n > num-infected-last-plotted [\r\n  plotxy ticks - 1 n\r\n  set num-infected-last-plotted n \r\n]", "pens": {} }
      , { "type": "hnwView",    "left": 362, "right": 782, "top": 112, "bottom": 532, "height": 400, "width": 400 }
      ]
    , "canJoinMidRun": true
    , "onConnect": "create-new-supervisor"
    , "onDisconnect": "remove-supervisor"
    , "onCursorClick": null
    , "onCursorMove": null
    }
  ]
, "nlogo": ";;;;;;;;;;;;;;;;;;;;;;;;;;;;;;;;;;;;;\r\n;; Variable and Breed declarations ;;\r\n;;;;;;;;;;;;;;;;;;;;;;;;;;;;;;;;;;;;;\r\n\r\nglobals [\r\n  run-number\r\n\r\n  ;; variables used to assign unique color and shape to clients\r\n  shape-names        ;; list that holds the names of the non-sick shapes a student's turtle can have\r\n  colors             ;; list that holds the colors used for students' turtles\r\n  color-names        ;; list that holds the names of the colors used for students' turtles\r\n  used-shape-colors  ;; list that holds the shape-color pairs that are already being used\r\n  max-possible-codes ;; total number of possible unique shape\/color combinations\r\n\r\n  ;; quick start instructions variables\r\n  quick-start  ;; current quickstart instruction displayed in the quickstart monitor\r\n  qs-item      ;; index of the current quickstart instruction\r\n  qs-items     ;; list of quickstart instructions\r\n\r\n  num-infected-last-plotted ;; used in plotting only\r\n                            ;; number of turtles that had infected? = true the last time we plotted.\r\n]\r\n\r\nturtles-own [\r\n  infected?    ;; if a turtle is sick, infected? is true, otherwise, it is false\r\n  base-shape   ;; original shape of a turtle\r\n  step-size    ;; the amount that a turtle will go forward in the current direction\r\n]\r\n\r\nbreed [ androids android ]  ;; created by the CREATE ANDROIDS button; not controlled by anyone, but can become sick and spread sickness\r\nbreed [ students student ]  ;; created and controlled by the clients\r\nbreed [ supervisors supervisor ]  ;; the overlord of this activity\r\n\r\nstudents-own [\r\n  description\r\n  located-at\r\n]\r\n\r\nsupervisors-own [\r\n\r\n  android-delay\r\n  infection-chance\r\n  initial-number-sick\r\n  number\r\n\r\n  show-sick?\r\n  show-sick-on-clients?\r\n  wander?\r\n\r\n]\r\n\r\n\r\n;;;;;;;;;;;;;;;;;;;;;;\r\n;; Setup Procedures ;;\r\n;;;;;;;;;;;;;;;;;;;;;;\r\n\r\nto startup\r\n  setup-vars\r\n  setup-quick-start\r\n  reset-ticks\r\nend\r\n\r\nto setup\r\n  ask androids [ die ]\r\n  cure-all\r\n  reset-ticks\r\nend\r\n\r\n;; heals all sick turtles,  clears and sets up the plot,\r\n;; and clears the lists sent to the calculators\r\nto cure-all\r\n  ask turtles\r\n  [\r\n    set infected? false\r\n    set shape base-shape\r\n  ]\r\n  set run-number run-number + 1\r\n  reset-ticks\r\nend\r\n\r\n;; initialize global variables\r\nto setup-vars\r\n  set shape-names [\"box\" \"star\" \"wheel\" \"target\" \"cat\" \"dog\"\r\n                   \"butterfly\" \"leaf\" \"car\" \"airplane\"\r\n                   \"monster\" \"key\" \"cow skull\" \"ghost\"\r\n                   \"cactus\" \"moon\" \"heart\"]\r\n  ;; these colors were chosen with the goal of having colors\r\n  ;; that are readily distinguishable from each other, and that\r\n  ;; have names that everyone knows (e.g. no \"cyan\"!), and that\r\n  ;; contrast sufficiently with the red infection dots and the\r\n  ;; gray androids\r\n  set colors      (list white brown green yellow\r\n                        (violet + 1) (sky + 1))\r\n  set color-names [\"white\" \"brown\" \"green\" \"yellow\"\r\n                   \"purple\" \"blue\"]\r\n  set max-possible-codes (length colors * length shape-names)\r\n  set used-shape-colors []\r\n  set run-number 1\r\nend\r\n\r\n;; creates turtles that wander at random\r\nto make-androids\r\n  create-androids ([number] of overseer)\r\n  [\r\n    move-to one-of patches\r\n    face one-of neighbors4\r\n    set color gray\r\n    set infected? false\r\n    set base-shape \"android\"\r\n    set shape base-shape\r\n    set step-size 1\r\n  ]\r\nend\r\n\r\n;;;;;;;;;;;;;;;;;;;;;;;;\r\n;; Runtime Procedures ;;\r\n;;;;;;;;;;;;;;;;;;;;;;;;\r\n\r\nto go\r\n\r\n  every 0.1\r\n  [\r\n    ;;allow the androids to wander around the view\r\n    if ([wander?] of overseer) [ androids-wander ]\r\n\r\n    ask turtles with [ infected? ]\r\n    [ spread-disease ]\r\n\r\n    ;; keeps track of the number of times through the go procedure (if there is at least one turtle infected)\r\n    ;; use an ifelse here to avoid redundant displays because tick forces a display.\r\n    ;; we only want to keep track of time once the first turtle has been infected.\r\n    ifelse count turtles with [infected?] > 0\r\n    [ tick ]\r\n    [ display ]\r\n  ]\r\nend\r\n\r\n;; controls the motion of the androids\r\nto androids-wander\r\n  every [android-delay] of overseer\r\n  [\r\n    ask androids\r\n    [\r\n      face one-of neighbors4\r\n      fd 1\r\n    ]\r\n  ]\r\nend\r\n\r\n;; additional check infect called when student moves to new patch\r\n;; added to avoid rewarding movement\r\nto student-move-check-infect\r\n  if infected?\r\n  [ spread-disease ]\r\n\r\n  ask other turtles-here with [ infected? ]\r\n  [ ask myself [ maybe-get-sick ] ]\r\nend\r\n\r\n;; spread disease to other turtles here\r\nto spread-disease\r\n  ask other turtles-here [ maybe-get-sick ]\r\nend\r\n\r\n\r\n;; turtle procedure -- roll the dice and maybe get sick\r\nto maybe-get-sick\r\n  if not infected? [\r\n    if ((random 100) + 1) <= infection-chance\r\n    [ get-sick ] ]\r\nend\r\n\r\n;; turtle procedure -- set the appropriate variables to make this turtle sick\r\nto get-sick\r\n  set infected? true\r\n  set-sick-shape\r\nend\r\n\r\n;; turtle procedure -- change the shape of turtles to its sick shape\r\n;; if show-sick? is true and change the shape to the base-shape if\r\n;; show-sick? is false\r\nto set-sick-shape\r\n  ifelse show-sick?\r\n  [\r\n    ;; we want to check if the turtles shape is already a sick shape\r\n    ;; to prevent flickering in the turtles\r\n    if shape != word base-shape \" sick\"\r\n    [ set shape word base-shape \" sick\" ]\r\n  ]\r\n  [\r\n    ;; we want to check if the turtles shape is already a base-shape\r\n    ;; to prevent flickering in the turtles\r\n    if shape != base-shape\r\n    [ set shape base-shape ]\r\n  ]\r\nend\r\n\r\n;; causes the initial infection in the turtle population --\r\n;; infects a random healthy turtle until the desired number of\r\n;; turtles are infected\r\nto infect-turtles\r\n  let healthy-turtles turtles with [ not infected? ]\r\n\r\n  ifelse count healthy-turtles < initial-number-sick\r\n  [\r\n    ask healthy-turtles\r\n    [\r\n      get-sick\r\n      set-sick-shape\r\n    ]\r\n    user-message \"There are no more healthy turtles to infect.  Infection stopped.\"\r\n    stop\r\n  ]\r\n  [\r\n    ask n-of initial-number-sick healthy-turtles\r\n    [\r\n      get-sick\r\n      set-sick-shape\r\n    ]\r\n  ]\r\nend\r\n\r\n;;;;;;;;;;;;;;;;;;;;;;;\r\n;; HubNet Procedures ;;\r\n;;;;;;;;;;;;;;;;;;;;;;;\r\n\r\n;; Create a turtle, set its shape, color, and position\r\n;; and tell the node what its turtle looks like and where it is\r\nto create-new-student\r\n  create-students 1\r\n  [\r\n    setup-student-vars\r\n    send-info-to-clients\r\n    ;; we want to make sure that the clients all have the same plot ranges,\r\n    ;; so when somebody logs in, set the plot ranges to themselves so that\r\n    ;; everybody will have the same size plots.\r\n    set-plot-y-range plot-y-min plot-y-max\r\n    set-plot-x-range plot-x-min plot-x-max\r\n  ]\r\nend\r\n\r\n;; sets the turtle variables to appropriate initial values\r\nto setup-student-vars\r\n  set-unique-shape-and-color\r\n  move-to one-of patches\r\n  face one-of neighbors4\r\n  set infected? false\r\n  set step-size 1\r\nend\r\n\r\n;; pick a base-shape and color for the turtle\r\nto set-unique-shape-and-color\r\n  let code random max-possible-codes\r\n  while [member? code used-shape-colors and count students < max-possible-codes]\r\n  [\r\n    set code random max-possible-codes\r\n  ]\r\n  set used-shape-colors (lput code used-shape-colors)\r\n  set base-shape item (code mod length shape-names) shape-names\r\n  set shape base-shape\r\n  set color item (code \/ length shape-names) colors\r\nend\r\n\r\n;; report the string version of the turtle's color\r\nto-report color-string [color-value]\r\n  report item (position color-value colors) color-names\r\nend\r\n\r\n;; sends the appropriate monitor information back to the client\r\nto send-info-to-clients\r\n  set description (word (color-string color) \" \" base-shape)\r\n  set located-at (word \"(\" pxcor \",\" pycor \")\")\r\nend\r\n\r\n;; Kill the turtle, set its shape, color, and position\r\n;; and tell the node what its turtle looks like and where it is\r\nto remove-student\r\n  set used-shape-colors remove my-code used-shape-colors\r\nend\r\n\r\n;; translates a student turtle's shape and color into a code\r\nto-report my-code\r\n  report (position base-shape shape-names) + (length shape-names) * (position color colors)\r\nend\r\n\r\n;; Cause the students to move forward step-size in new-heading's heading\r\nto execute-move [new-heading]\r\n  set heading new-heading\r\n  fd step-size\r\n  set located-at (word \"(\" pxcor \",\" pycor \")\")\r\n\r\n  ;; maybe infect or get infected by turtles on the patch student moved to\r\n  student-move-check-infect\r\nend\r\n\r\n;;; this procedure is handy for testing out additional shapes and colors;\r\n;;; you can call it from the Command Center\r\nto show-gamut\r\n  clear-all\r\n  setup-vars\r\n  create-ordered-turtles max-possible-codes [\r\n    fd max-pxcor * 0.7\r\n    if who mod 3 = 0\r\n      [ fd max-pxcor * 0.3 ]\r\n    if who mod 3 = 1\r\n      [ fd max-pxcor * 0.15 ]\r\n    set heading 0\r\n    set-unique-shape-and-color\r\n  ]\r\n  ask patch 0 0 [\r\n    ask patches in-radius 2 [\r\n      sprout-androids 1 [\r\n        set shape \"android\"\r\n        set color gray\r\n      ]\r\n    ]\r\n  ]\r\n  user-message (word length shape-names\r\n              \" shapes * \"\r\n              length colors\r\n              \" colors = \"\r\n              max-possible-codes\r\n              \" combinations\")\r\nend\r\n\r\n;;;;;;;;;;;;;;;;;;;;;;;;;;;;\r\n;; Quick Start Procedures ;;\r\n;;;;;;;;;;;;;;;;;;;;;;;;;;;;\r\n\r\n;; instructions to quickly setup the model, and clients to run this activity\r\nto setup-quick-start\r\n  set qs-item 0\r\n  set qs-items\r\n  [\r\n    \"Teacher: Follow these directions to run the HubNet activity.\"\r\n    \"Optional: Zoom In (see Tools in the Menu Bar)\"\r\n    \"Optional: Change any of the settings.\"\r\n    \"If you want to add androids press the CREATE ANDROIDS button\"\r\n    \"Press the GO button.\"\r\n    \"Everyone: Open up a HubNet Client on your machine and...\"\r\n      \"type your user name, select this activity and press ENTER.\"\r\n    \"Teacher: Have the students move their turtles around to...\"\r\n      \"acquaint themselves with the interface.\"\r\n    \"Press the INFECT button to start the simulation.\"\r\n    \"Everyone: Watch the plot of the number infected.\"\r\n\r\n    \"Teacher: To run the activity again with the same group,...\"\r\n      \"stop the model by pressing the GO button, if it is on.\"\r\n        \"Change any of the settings that you would like.\"\r\n   \"Press the CURE-ALL button to keep the androids, or SETUP to clear them\"\r\n    \"Teacher: Restart the simulation by pressing the GO button again.\"\r\n      \"Infect some turtles and continue.\"\r\n\r\n    \"Teacher: To start the simulation over with a new group,...\"\r\n      \"stop the model by pressing the GO button, if it is on...\"\r\n        \"have all the students log out...\"\r\n    \"or press the RESET button in the Control Center\"\r\n        \"start these instructions from the beginning\"\r\n  ]\r\n  set quick-start (item qs-item qs-items)\r\nend\r\n\r\n;; view the next item in the quickstart monitor\r\nto view-next\r\n  set qs-item qs-item + 1\r\n  if qs-item >= length qs-items\r\n  [ set qs-item length qs-items - 1 ]\r\n  set quick-start (item qs-item qs-items)\r\nend\r\n\r\n;; view the previous item in the quickstart monitor\r\nto view-prev\r\n  set qs-item qs-item - 1\r\n  if qs-item < 0\r\n  [ set qs-item 0 ]\r\n  set quick-start (item qs-item qs-items)\r\nend\r\n\r\n\r\n\r\n;; Begin new additions\r\n\r\n;; Student role\r\n\r\nto move-up\r\n  execute-move 0\r\nend\r\n\r\nto move-down\r\n  execute-move 180\r\nend\r\n\r\nto move-left\r\n  execute-move 270\r\nend\r\n\r\nto move-right\r\n  execute-move 90\r\nend\r\n\r\nto change-appearance\r\n  set used-shape-colors remove my-code used-shape-colors\r\n  show-turtle\r\n  set-unique-shape-and-color\r\n  set description (word (color-string color) \" \" base-shape)\r\n  if infected? [ set-sick-shape ]\r\nend\r\n\r\nto-report sick?-str\r\n  report (ifelse-value ([show-sick-on-clients?] of overseer) [ infected? ] [ \"N\/A\" ])\r\nend\r\n\r\n;; Supervisor role\r\n\r\nto-report overseer\r\n  report one-of supervisors\r\nend\r\n\r\nto clear-the-plot\r\n  clear-all-plots\r\n  set run-number 0\r\nend\r\n\r\nto-report num-turtles\r\n  report count turtles\r\nend\r\n\r\nto-report num-infected\r\n  report count turtles with [infected?]\r\nend\r\n\r\n; Copyright 1999 Uri Wilensky and Walter Stroup.\r\n; See Info tab for full copyright and license.\r\n@#$#@#$#@\r\nGRAPHICS-WINDOW\r\n273\r\n94\r\n701\r\n523\r\n-1\r\n-1\r\n20.0\r\n1\r\n10\r\n1\r\n1\r\n1\r\n0\r\n0\r\n0\r\n1\r\n-10\r\n10\r\n-10\r\n10\r\n1\r\n1\r\n1\r\nticks\r\n30.0\r\n\r\nBUTTON\r\n131\r\n10\r\n209\r\n43\r\nNIL\r\ngo\r\nT\r\n1\r\nT\r\nOBSERVER\r\nNIL\r\nNIL\r\nNIL\r\nNIL\r\n1\r\n\r\nPLOT\r\n14\r\n367\r\n258\r\n564\r\nNumber Sick\r\ntime\r\nsick\r\n0.0\r\n25.0\r\n0.0\r\n6.0\r\ntrue\r\nfalse\r\n\";; create a temporary plot pen for the current run\\ncreate-temporary-plot-pen word \\\"run \\\" run-number\\n;; cycle through a few colors so it is easy to\\n;; differentiate the runs.\\nset-plot-pen-color item (run-number mod 5) [blue red green orange violet]\\n;; each run starts with zero infected.\\nset num-infected-last-plotted 0\" \"let n count turtles with [infected?] \\n;; only plot if someone has been infected since the last time we plotted. \\n;; this smoothes out the plot a bit.\\nif n > num-infected-last-plotted [\\n  plotxy ticks - 1 n\\n  set num-infected-last-plotted n \\n]\"\r\nPENS\r\n\"not-used\" 1.0 0 -16777216 false \"\" \"\"\r\n\r\nBUTTON\r\n53\r\n10\r\n130\r\n43\r\nNIL\r\nsetup\r\nNIL\r\n1\r\nT\r\nOBSERVER\r\nNIL\r\nNIL\r\nNIL\r\nNIL\r\n1\r\n\r\n@#$#@#$#@\r\n## WHAT IS IT?\r\n\r\nThis model simulates the spread of a disease through a population.  This population can consist of either students, which are turtles controlled by individual students via the HubNet Client, or turtles that are generated and controlled by NetLogo, called androids, or both androids and students.\r\n\r\nTurtles move around, possibly catching an infection.  Healthy turtles on the same patch as sick turtles have a INFECTION-CHANCE chance of becoming ill.  A plot shows the number of sick turtles at each time tick, and if SHOW-ILL? is on, sick turtles have a red circle attached to their shape.\r\n\r\nInitially, all turtles are healthy.  A number of turtles equal to INITIAL-NUMBER-SICK become ill when the INFECT button is depressed.\r\n\r\nFor further documentation, see the Participatory Simulations Guide found at http:\/\/ccl.northwestern.edu\/rp\/ps\/index.shtml.\r\n\r\n## HOW TO USE IT\r\n\r\nQuickstart Instructions:\r\n\r\nTeacher: Follow these directions to run the HubNet activity.\r\nOptional: Zoom In (see Tools in the Menu Bar)\r\nOptional: Change any of the settings. If you want to add androids press the CREATE ANDROIDS button.  Press the GO button.\r\nEveryone: Open up a HubNet client on your machine and type your user name, select this activity and press ENTER.\r\nTeacher: Have the students move their turtles around to acquaint themselves with the interface. Press the INFECT button to start the simulation.\r\nEveryone: Watch the plot of the number infected.\r\nTeacher: To run the activity again with the same group, stop the model by pressing the NetLogo GO button, if it is on. Change any of the settings that you would like.  Press the CURE-ALL button to keep the androids, or SETUP to clear them\r\nTeacher: Restart the simulation by pressing the NetLogo GO button again. Infect some turtles and continue.\r\nTeacher: To start the simulation over with a new group, stop the model by pressing the GO button, if it is on, have all the students log out or press the RESET button in the Control Center, and start these instructions from the beginning\r\n\r\nButtons:\r\n\r\nSETUP - returns the model to the starting state, all student turtles are cured and androids are killed.  The plot is advanced to start a new run but it is not cleared.\r\nCURE-ALL - cures all turtles, androids are kept.  The plot is advanced to start a new run but it is not cleared.\r\nGO - runs the simulation\r\nCREATE ANDROIDS - adds randomly moving turtles to the simulation\r\nINFECT - infects INITIAL-NUMBER-SICK turtles in the simulation\r\nNEXT >>> - shows the next quick start instruction\r\n<<< PREVIOUS - shows the previous quick start instruction\r\nRESET INSTRUCTIONS - shows the first quick start instruction\r\n\r\nSliders:\r\n\r\nNUMBER - determines how many androids are created by the CREATE ANDROIDS button\r\nANDROID-DELAY - the delay time, in seconds, for android movement - the higher the number, the slower the androids move\r\nINITIAL-NUMBER-SICK - the number of turtles that become infected spontaneously when the INFECT button is pressed\r\nINFECTION-CHANCE - sets the percentage chance that every tenth of a second a healthy turtle will become sick if it is on the same patch as an infected turtle\r\n\r\nSwitches:\r\n\r\nWANDER? - when on, the androids wander randomly.  When off, they sit still\r\nSHOW-SICK? - when on, sick turtles add to their original shape a red circle.  When off, they can move through the populace unnoticed\r\nSHOW-SICK-ON-CLIENTS? - when on, the clients will be told if their turtle is sick or not.\r\n\r\nMonitors:\r\n\r\nTURTLES - the number of turtles in the simulation\r\nNUMBER SICK - the number of turtles that are infected\r\n\r\nPlots:\r\n\r\nNUMBER SICK - shows the number of sick turtles versus time\r\n\r\nClient Information\r\n\r\nAfter logging in, the client interface will appear for the students, and if GO is pressed in NetLogo they will be assigned a turtle which will be described in the YOU ARE A: monitor.  And their current location will be shown in the LOCATED AT: monitor.  If the student doesn't like their assigned shape and\/or color they can hit the CHANGE APPEARANCE button at any time to change to another random appearance.\r\n\r\nThe SICK? monitor will show one of three values: \"true\" \"false\" or \"N\/A\".  \"N\/A\" will be shown if the NetLogo SHOW-ILL-ON-CLIENTS? switch is off, otherwise \"true\" will be shown if your turtle is infected, or \"false\" will be shown if your turtle is not infected.\r\n\r\nThe student controls the movement of their turtle with the UP, DOWN, LEFT, and RIGHT buttons and the STEP-SIZE slider.  Clicking any of the directional buttons will cause their turtle to move in the respective direction a distance of STEP-SIZE.\r\n\r\n## THINGS TO NOTICE\r\n\r\nNo matter how you change the various parameters, the same basic plot shape emerges.  After using the model once with the students, ask them how they think the plot will change if you alter a parameter.  Altering the initial percentage sick and the infection chance will have different effects on the plot.\r\n\r\n## THINGS TO TRY\r\n\r\nUse the model with the entire class to serve as an introduction to the topic.  Then have students use the NetLogo model individually, in a computer lab, to explore the effects of the various parameters.  Discuss what they find, observe, and can conclude from this model.\r\n\r\n## EXTENDING THE MODEL\r\n\r\nCurrently, the turtles remain sick once they're infected.  How would the shape of the plot change if turtles eventually healed?  If, after healing, they were immune to the disease, or could still spread the disease, how would the dynamics be altered?\r\n\r\n## HOW TO CITE\r\n\r\nIf you mention this model or the NetLogo software in a publication, we ask that you include the citations below.\r\n\r\nFor the model itself:\r\n\r\n* Wilensky, U. and Stroup, W. (1999).  NetLogo HubNet Disease HubNet model.  http:\/\/ccl.northwestern.edu\/netlogo\/models\/HubNetDiseaseHubNet.  Center for Connected Learning and Computer-Based Modeling, Northwestern University, Evanston, IL.\r\n\r\nPlease cite the NetLogo software as:\r\n\r\n* Wilensky, U. (1999). NetLogo. http:\/\/ccl.northwestern.edu\/netlogo\/. Center for Connected Learning and Computer-Based Modeling, Northwestern University, Evanston, IL.\r\n\r\n## COPYRIGHT AND LICENSE\r\n\r\nCopyright 1999 Uri Wilensky and Walter Stroup.\r\n\r\n![CC BY-NC-SA 3.0](http:\/\/ccl.northwestern.edu\/images\/creativecommons\/byncsa.png)\r\n\r\nThis work is licensed under the Creative Commons Attribution-NonCommercial-ShareAlike 3.0 License.  To view a copy of this license, visit https:\/\/creativecommons.org\/licenses\/by-nc-sa\/3.0\/ or send a letter to Creative Commons, 559 Nathan Abbott Way, Stanford, California 94305, USA.\r\n\r\nCommercial licenses are also available. To inquire about commercial licenses, please contact Uri Wilensky at uri@northwestern.edu.\r\n\r\nThis activity and associated models and materials were created as part of the projects: PARTICIPATORY SIMULATIONS: NETWORK-BASED DESIGN FOR SYSTEMS LEARNING IN CLASSROOMS and\/or INTEGRATED SIMULATION AND MODELING ENVIRONMENT. The project gratefully acknowledges the support of the National Science Foundation (REPP & ROLE programs) -- grant numbers REC #9814682 and REC-0126227.\r\n\r\n<!-- 1999 Stroup -->\r\n@#$#@#$#@\r\ndefault\r\ntrue\r\n0\r\nPolygon -7500403 true true 150 5 40 250 150 205 260 250\r\n\r\nairplane\r\ntrue\r\n0\r\nPolygon -7500403 true true 150 0 135 15 120 60 120 105 15 165 15 195 120 180 135 240 105 270 120 285 150 270 180 285 210 270 165 240 180 180 285 195 285 165 180 105 180 60 165 15\r\n\r\nairplane sick\r\ntrue\r\n0\r\nPolygon -7500403 true true 150 0 135 15 120 60 120 105 15 165 15 195 120 180 135 240 105 270 120 285 150 270 180 285 210 270 165 240 180 180 285 195 285 165 180 105 180 60 165 15\r\nCircle -2674135 true false 150 165 90\r\n\r\nandroid\r\nfalse\r\n0\r\nPolygon -7500403 true true 210 90 240 195 210 210 165 90\r\nCircle -7500403 true true 110 3 80\r\nPolygon -7500403 true true 105 88 120 193 105 240 105 298 135 300 150 210 165 300 195 298 195 240 180 193 195 88\r\nRectangle -7500403 true true 127 81 172 96\r\nRectangle -16777216 true false 135 33 165 60\r\nPolygon -7500403 true true 90 90 60 195 90 210 135 90\r\n\r\nandroid sick\r\nfalse\r\n0\r\nPolygon -7500403 true true 210 90 240 195 210 210 165 90\r\nCircle -7500403 true true 110 3 80\r\nPolygon -7500403 true true 105 88 120 193 105 240 105 298 135 300 150 210 165 300 195 298 195 240 180 193 195 88\r\nRectangle -7500403 true true 127 81 172 96\r\nRectangle -16777216 true false 135 33 165 60\r\nPolygon -7500403 true true 90 90 60 195 90 210 135 90\r\nCircle -2674135 true false 150 120 120\r\n\r\nbox\r\nfalse\r\n0\r\nPolygon -7500403 true true 150 285 285 225 285 75 150 135\r\nPolygon -7500403 true true 150 135 15 75 150 15 285 75\r\nPolygon -7500403 true true 15 75 15 225 150 285 150 135\r\nLine -16777216 false 150 285 150 135\r\nLine -16777216 false 150 135 15 75\r\nLine -16777216 false 150 135 285 75\r\n\r\nbox sick\r\nfalse\r\n0\r\nPolygon -7500403 true true 150 285 270 225 270 90 150 150\r\nPolygon -7500403 true true 150 150 30 90 150 30 270 90\r\nPolygon -7500403 true true 30 90 30 225 150 285 150 150\r\nLine -16777216 false 150 285 150 150\r\nLine -16777216 false 150 150 30 90\r\nLine -16777216 false 150 150 270 90\r\nCircle -2674135 true false 170 178 108\r\n\r\nbutterfly\r\nfalse\r\n0\r\nRectangle -7500403 true true 92 135 207 224\r\nCircle -7500403 true true 158 53 134\r\nCircle -7500403 true true 165 180 90\r\nCircle -7500403 true true 45 180 90\r\nCircle -7500403 true true 8 53 134\r\nLine -16777216 false 43 189 253 189\r\nRectangle -7500403 true true 135 60 165 285\r\nCircle -7500403 true true 165 15 30\r\nCircle -7500403 true true 105 15 30\r\nLine -7500403 true 120 30 135 60\r\nLine -7500403 true 165 60 180 30\r\nLine -16777216 false 135 60 135 285\r\nLine -16777216 false 165 285 165 60\r\n\r\nbutterfly sick\r\nfalse\r\n0\r\nRectangle -7500403 true true 92 135 207 224\r\nCircle -7500403 true true 158 53 134\r\nCircle -7500403 true true 165 180 90\r\nCircle -7500403 true true 45 180 90\r\nCircle -7500403 true true 8 53 134\r\nLine -16777216 false 43 189 253 189\r\nRectangle -7500403 true true 135 60 165 285\r\nCircle -7500403 true true 165 15 30\r\nCircle -7500403 true true 105 15 30\r\nLine -7500403 true 120 30 135 60\r\nLine -7500403 true 165 60 180 30\r\nLine -16777216 false 135 60 135 285\r\nLine -16777216 false 165 285 165 60\r\nCircle -2674135 true false 156 171 108\r\n\r\ncactus\r\nfalse\r\n0\r\nRectangle -7500403 true true 135 30 175 177\r\nRectangle -7500403 true true 67 105 100 214\r\nRectangle -7500403 true true 217 89 251 167\r\nRectangle -7500403 true true 157 151 220 185\r\nRectangle -7500403 true true 94 189 148 233\r\nRectangle -7500403 true true 135 162 184 297\r\nCircle -7500403 true true 219 76 28\r\nCircle -7500403 true true 138 7 34\r\nCircle -7500403 true true 67 93 30\r\nCircle -7500403 true true 201 145 40\r\nCircle -7500403 true true 69 193 40\r\n\r\ncactus sick\r\nfalse\r\n0\r\nRectangle -7500403 true true 135 30 175 177\r\nRectangle -7500403 true true 67 105 100 214\r\nRectangle -7500403 true true 217 89 251 167\r\nRectangle -7500403 true true 157 151 220 185\r\nRectangle -7500403 true true 94 189 148 233\r\nRectangle -7500403 true true 135 162 184 297\r\nCircle -7500403 true true 219 76 28\r\nCircle -7500403 true true 138 7 34\r\nCircle -7500403 true true 67 93 30\r\nCircle -7500403 true true 201 145 40\r\nCircle -7500403 true true 69 193 40\r\nCircle -2674135 true false 156 171 108\r\n\r\ncar\r\nfalse\r\n0\r\nPolygon -7500403 true true 300 180 279 164 261 144 240 135 226 132 213 106 203 84 185 63 159 50 135 50 75 60 0 150 0 165 0 225 300 225 300 180\r\nCircle -16777216 true false 180 180 90\r\nCircle -16777216 true false 30 180 90\r\nPolygon -16777216 true false 162 80 132 78 134 135 209 135 194 105 189 96 180 89\r\nCircle -7500403 true true 47 195 58\r\nCircle -7500403 true true 195 195 58\r\n\r\ncar sick\r\nfalse\r\n0\r\nPolygon -7500403 true true 285 208 285 178 279 164 261 144 240 135 226 132 213 106 199 84 171 68 149 68 129 68 75 75 15 150 15 165 15 225 285 225 283 174 283 176\r\nCircle -16777216 true false 180 180 90\r\nCircle -16777216 true false 30 180 90\r\nPolygon -16777216 true false 195 90 135 90 135 135 210 135 195 105 165 90\r\nCircle -7500403 true true 47 195 58\r\nCircle -7500403 true true 195 195 58\r\nCircle -2674135 true false 171 156 108\r\n\r\ncat\r\nfalse\r\n0\r\nLine -7500403 true 285 240 210 240\r\nLine -7500403 true 195 300 165 255\r\nLine -7500403 true 15 240 90 240\r\nLine -7500403 true 285 285 195 240\r\nLine -7500403 true 105 300 135 255\r\nLine -16777216 false 150 270 150 285\r\nLine -16777216 false 15 75 15 120\r\nPolygon -7500403 true true 300 15 285 30 255 30 225 75 195 60 255 15\r\nPolygon -7500403 true true 285 135 210 135 180 150 180 45 285 90\r\nPolygon -7500403 true true 120 45 120 210 180 210 180 45\r\nPolygon -7500403 true true 180 195 165 300 240 285 255 225 285 195\r\nPolygon -7500403 true true 180 225 195 285 165 300 150 300 150 255 165 225\r\nPolygon -7500403 true true 195 195 195 165 225 150 255 135 285 135 285 195\r\nPolygon -7500403 true true 15 135 90 135 120 150 120 45 15 90\r\nPolygon -7500403 true true 120 195 135 300 60 285 45 225 15 195\r\nPolygon -7500403 true true 120 225 105 285 135 300 150 300 150 255 135 225\r\nPolygon -7500403 true true 105 195 105 165 75 150 45 135 15 135 15 195\r\nPolygon -7500403 true true 285 120 270 90 285 15 300 15\r\nLine -7500403 true 15 285 105 240\r\nPolygon -7500403 true true 15 120 30 90 15 15 0 15\r\nPolygon -7500403 true true 0 15 15 30 45 30 75 75 105 60 45 15\r\nLine -16777216 false 164 262 209 262\r\nLine -16777216 false 223 231 208 261\r\nLine -16777216 false 136 262 91 262\r\nLine -16777216 false 77 231 92 261\r\n\r\ncat sick\r\nfalse\r\n0\r\nLine -7500403 true 285 240 210 240\r\nLine -7500403 true 195 300 165 255\r\nLine -7500403 true 15 240 90 240\r\nLine -7500403 true 285 285 195 240\r\nLine -7500403 true 105 300 135 255\r\nLine -16777216 false 150 270 150 285\r\nLine -16777216 false 15 75 15 120\r\nPolygon -7500403 true true 300 15 285 30 255 30 225 75 195 60 255 15\r\nPolygon -7500403 true true 285 135 210 135 180 150 180 45 285 90\r\nPolygon -7500403 true true 120 45 120 210 180 210 180 45\r\nPolygon -7500403 true true 180 195 165 300 240 285 255 225 285 195\r\nPolygon -7500403 true true 180 225 195 285 165 300 150 300 150 255 165 225\r\nPolygon -7500403 true true 195 195 195 165 225 150 255 135 285 135 285 195\r\nPolygon -7500403 true true 15 135 90 135 120 150 120 45 15 90\r\nPolygon -7500403 true true 120 195 135 300 60 285 45 225 15 195\r\nPolygon -7500403 true true 120 225 105 285 135 300 150 300 150 255 135 225\r\nPolygon -7500403 true true 105 195 105 165 75 150 45 135 15 135 15 195\r\nPolygon -7500403 true true 285 120 270 90 285 15 300 15\r\nLine -7500403 true 15 285 105 240\r\nPolygon -7500403 true true 15 120 30 90 15 15 0 15\r\nPolygon -7500403 true true 0 15 15 30 45 30 75 75 105 60 45 15\r\nLine -16777216 false 164 262 209 262\r\nLine -16777216 false 223 231 208 261\r\nLine -16777216 false 136 262 91 262\r\nLine -16777216 false 77 231 92 261\r\nCircle -2674135 true false 186 186 108\r\n\r\ncow skull\r\nfalse\r\n0\r\nPolygon -7500403 true true 150 90 75 105 60 150 75 210 105 285 195 285 225 210 240 150 225 105\r\nPolygon -16777216 true false 150 150 90 195 90 150\r\nPolygon -16777216 true false 150 150 210 195 210 150\r\nPolygon -16777216 true false 105 285 135 270 150 285 165 270 195 285\r\nPolygon -7500403 true true 240 150 263 143 278 126 287 102 287 79 280 53 273 38 261 25 246 15 227 8 241 26 253 46 258 68 257 96 246 116 229 126\r\nPolygon -7500403 true true 60 150 37 143 22 126 13 102 13 79 20 53 27 38 39 25 54 15 73 8 59 26 47 46 42 68 43 96 54 116 71 126\r\n\r\ncow skull sick\r\nfalse\r\n0\r\nPolygon -7500403 true true 150 90 75 105 60 150 75 210 105 285 195 285 225 210 240 150 225 105\r\nPolygon -16777216 true false 150 150 90 195 90 150\r\nPolygon -16777216 true false 150 150 210 195 210 150\r\nPolygon -16777216 true false 105 285 135 270 150 285 165 270 195 285\r\nPolygon -7500403 true true 240 150 263 143 278 126 287 102 287 79 280 53 273 38 261 25 246 15 227 8 241 26 253 46 258 68 257 96 246 116 229 126\r\nPolygon -7500403 true true 60 150 37 143 22 126 13 102 13 79 20 53 27 38 39 25 54 15 73 8 59 26 47 46 42 68 43 96 54 116 71 126\r\nCircle -2674135 true false 156 186 108\r\n\r\ndog\r\nfalse\r\n0\r\nPolygon -7500403 true true 300 165 300 195 270 210 183 204 180 240 165 270 165 300 120 300 0 240 45 165 75 90 75 45 105 15 135 45 165 45 180 15 225 15 255 30 225 30 210 60 225 90 225 105\r\nPolygon -16777216 true false 0 240 120 300 165 300 165 285 120 285 10 221\r\nLine -16777216 false 210 60 180 45\r\nLine -16777216 false 90 45 90 90\r\nLine -16777216 false 90 90 105 105\r\nLine -16777216 false 105 105 135 60\r\nLine -16777216 false 90 45 135 60\r\nLine -16777216 false 135 60 135 45\r\nLine -16777216 false 181 203 151 203\r\nLine -16777216 false 150 201 105 171\r\nCircle -16777216 true false 171 88 34\r\nCircle -16777216 false false 261 162 30\r\n\r\ndog sick\r\nfalse\r\n0\r\nPolygon -7500403 true true 300 165 300 195 270 210 183 204 180 240 165 270 165 300 120 300 0 240 45 165 75 90 75 45 105 15 135 45 165 45 180 15 225 15 255 30 225 30 210 60 225 90 225 105\r\nPolygon -16777216 true false 0 240 120 300 165 300 165 285 120 285 10 221\r\nLine -16777216 false 210 60 180 45\r\nLine -16777216 false 90 45 90 90\r\nLine -16777216 false 90 90 105 105\r\nLine -16777216 false 105 105 135 60\r\nLine -16777216 false 90 45 135 60\r\nLine -16777216 false 135 60 135 45\r\nLine -16777216 false 181 203 151 203\r\nLine -16777216 false 150 201 105 171\r\nCircle -16777216 true false 171 88 34\r\nCircle -16777216 false false 261 162 30\r\nCircle -2674135 true false 126 186 108\r\n\r\nghost\r\nfalse\r\n0\r\nPolygon -7500403 true true 30 165 13 164 -2 149 0 135 -2 119 0 105 15 75 30 75 58 104 43 119 43 134 58 134 73 134 88 104 73 44 78 14 103 -1 193 -1 223 29 208 89 208 119 238 134 253 119 240 105 238 89 240 75 255 60 270 60 283 74 300 90 298 104 298 119 300 135 285 135 285 150 268 164 238 179 208 164 208 194 238 209 253 224 268 239 268 269 238 299 178 299 148 284 103 269 58 284 43 299 58 269 103 254 148 254 193 254 163 239 118 209 88 179 73 179 58 164\r\nLine -16777216 false 189 253 215 253\r\nCircle -16777216 true false 102 30 30\r\nPolygon -16777216 true false 165 105 135 105 120 120 105 105 135 75 165 75 195 105 180 120\r\nCircle -16777216 true false 160 30 30\r\n\r\nghost sick\r\nfalse\r\n0\r\nPolygon -7500403 true true 30 165 13 164 -2 149 0 135 -2 119 0 105 15 75 30 75 58 104 43 119 43 134 58 134 73 134 88 104 73 44 78 14 103 -1 193 -1 223 29 208 89 208 119 238 134 253 119 240 105 238 89 240 75 255 60 270 60 283 74 300 90 298 104 298 119 300 135 285 135 285 150 268 164 238 179 208 164 208 194 238 209 253 224 268 239 268 269 238 299 178 299 148 284 103 269 58 284 43 299 58 269 103 254 148 254 193 254 163 239 118 209 88 179 73 179 58 164\r\nLine -16777216 false 189 253 215 253\r\nCircle -16777216 true false 102 30 30\r\nPolygon -16777216 true false 165 105 135 105 120 120 105 105 135 75 165 75 195 105 180 120\r\nCircle -16777216 true false 160 30 30\r\nCircle -2674135 true false 156 171 108\r\n\r\nheart\r\nfalse\r\n0\r\nCircle -7500403 true true 152 19 134\r\nPolygon -7500403 true true 150 105 240 105 270 135 150 270\r\nPolygon -7500403 true true 150 105 60 105 30 135 150 270\r\nLine -7500403 true 150 270 150 135\r\nRectangle -7500403 true true 135 90 180 135\r\nCircle -7500403 true true 14 19 134\r\n\r\nheart sick\r\nfalse\r\n0\r\nCircle -7500403 true true 152 19 134\r\nPolygon -7500403 true true 150 105 240 105 270 135 150 270\r\nPolygon -7500403 true true 150 105 60 105 30 135 150 270\r\nLine -7500403 true 150 270 150 135\r\nRectangle -7500403 true true 135 90 180 135\r\nCircle -7500403 true true 14 19 134\r\nCircle -2674135 true false 171 156 108\r\n\r\nkey\r\nfalse\r\n0\r\nRectangle -7500403 true true 90 120 300 150\r\nRectangle -7500403 true true 270 135 300 195\r\nRectangle -7500403 true true 195 135 225 195\r\nCircle -7500403 true true 0 60 150\r\nCircle -16777216 true false 30 90 90\r\n\r\nkey sick\r\nfalse\r\n0\r\nRectangle -7500403 true true 90 120 300 150\r\nRectangle -7500403 true true 270 135 300 195\r\nRectangle -7500403 true true 195 135 225 195\r\nCircle -7500403 true true 0 60 150\r\nCircle -16777216 true false 30 90 90\r\nCircle -2674135 true false 156 171 108\r\n\r\nleaf\r\nfalse\r\n0\r\nPolygon -7500403 true true 150 210 135 195 120 210 60 210 30 195 60 180 60 165 15 135 30 120 15 105 40 104 45 90 60 90 90 105 105 120 120 120 105 60 120 60 135 30 150 15 165 30 180 60 195 60 180 120 195 120 210 105 240 90 255 90 263 104 285 105 270 120 285 135 240 165 240 180 270 195 240 210 180 210 165 195\r\nPolygon -7500403 true true 135 195 135 240 120 255 105 255 105 285 135 285 165 240 165 195\r\n\r\nleaf sick\r\nfalse\r\n0\r\nPolygon -7500403 true true 150 210 135 195 120 210 60 210 30 195 60 180 60 165 15 135 30 120 15 105 40 104 45 90 60 90 90 105 105 120 120 120 105 60 120 60 135 30 150 15 165 30 180 60 195 60 180 120 195 120 210 105 240 90 255 90 263 104 285 105 270 120 285 135 240 165 240 180 270 195 240 210 180 210 165 195\r\nPolygon -7500403 true true 135 195 135 240 120 255 105 255 105 285 135 285 165 240 165 195\r\nCircle -2674135 true false 141 171 108\r\n\r\nmonster\r\nfalse\r\n0\r\nPolygon -7500403 true true 75 150 90 195 210 195 225 150 255 120 255 45 180 0 120 0 45 45 45 120\r\nCircle -16777216 true false 165 60 60\r\nCircle -16777216 true false 75 60 60\r\nPolygon -7500403 true true 225 150 285 195 285 285 255 300 255 210 180 165\r\nPolygon -7500403 true true 75 150 15 195 15 285 45 300 45 210 120 165\r\nPolygon -7500403 true true 210 210 225 285 195 285 165 165\r\nPolygon -7500403 true true 90 210 75 285 105 285 135 165\r\nRectangle -7500403 true true 135 165 165 270\r\n\r\nmonster sick\r\nfalse\r\n0\r\nPolygon -7500403 true true 75 150 90 195 210 195 225 150 255 120 255 45 180 0 120 0 45 45 45 120\r\nCircle -16777216 true false 165 60 60\r\nCircle -16777216 true false 75 60 60\r\nPolygon -7500403 true true 225 150 285 195 285 285 255 300 255 210 180 165\r\nPolygon -7500403 true true 75 150 15 195 15 285 45 300 45 210 120 165\r\nPolygon -7500403 true true 210 210 225 285 195 285 165 165\r\nPolygon -7500403 true true 90 210 75 285 105 285 135 165\r\nRectangle -7500403 true true 135 165 165 270\r\nCircle -2674135 true false 141 141 108\r\n\r\nmoon\r\nfalse\r\n0\r\nPolygon -7500403 true true 175 7 83 36 25 108 27 186 79 250 134 271 205 274 281 239 207 233 152 216 113 185 104 132 110 77 132 51\r\n\r\nmoon sick\r\nfalse\r\n0\r\nPolygon -7500403 true true 160 7 68 36 10 108 12 186 64 250 119 271 190 274 266 239 192 233 137 216 98 185 89 132 95 77 117 51\r\nCircle -2674135 true false 171 171 108\r\n\r\nstar\r\nfalse\r\n0\r\nPolygon -7500403 true true 151 1 185 108 298 108 207 175 242 282 151 216 59 282 94 175 3 108 116 108\r\n\r\nstar sick\r\nfalse\r\n0\r\nPolygon -7500403 true true 151 1 185 108 298 108 207 175 242 282 151 216 59 282 94 175 3 108 116 108\r\nCircle -2674135 true false 156 171 108\r\n\r\ntarget\r\nfalse\r\n0\r\nCircle -7500403 true true 0 0 300\r\nCircle -16777216 true false 30 30 240\r\nCircle -7500403 true true 60 60 180\r\nCircle -16777216 true false 90 90 120\r\nCircle -7500403 true true 120 120 60\r\n\r\ntarget sick\r\ntrue\r\n0\r\nCircle -7500403 true true 0 0 300\r\nCircle -16777216 true false 30 30 240\r\nCircle -7500403 true true 60 60 180\r\nCircle -16777216 true false 90 90 120\r\nCircle -7500403 true true 120 120 60\r\nCircle -2674135 true false 163 163 95\r\n\r\nwheel\r\nfalse\r\n0\r\nCircle -7500403 true true 3 3 294\r\nCircle -16777216 true false 30 30 240\r\nLine -7500403 true 150 285 150 15\r\nLine -7500403 true 15 150 285 150\r\nCircle -7500403 true true 120 120 60\r\nLine -7500403 true 216 40 79 269\r\nLine -7500403 true 40 84 269 221\r\nLine -7500403 true 40 216 269 79\r\nLine -7500403 true 84 40 221 269\r\n\r\nwheel sick\r\nfalse\r\n0\r\nCircle -7500403 true true 3 3 294\r\nCircle -16777216 true false 30 30 240\r\nLine -7500403 true 150 285 150 15\r\nLine -7500403 true 15 150 285 150\r\nCircle -7500403 true true 120 120 60\r\nLine -7500403 true 216 40 79 269\r\nLine -7500403 true 40 84 269 221\r\nLine -7500403 true 40 216 269 79\r\nLine -7500403 true 84 40 221 269\r\nCircle -2674135 true false 156 156 108\r\n@#$#@#$#@\r\nNetLogo 6.1.1-RC1\r\n@#$#@#$#@\r\nneed-to-manually-make-preview-for-this-model\r\n@#$#@#$#@\r\n@#$#@#$#@\r\n@#$#@#$#@\r\nVIEW\r\n252\r\n10\r\n672\r\n430\r\n0\r\n0\r\n0\r\n1\r\n1\r\n1\r\n1\r\n1\r\n0\r\n1\r\n1\r\n1\r\n-10\r\n10\r\n-10\r\n10\r\n\r\nBUTTON\r\n91\r\n133\r\n153\r\n166\r\nUp\r\nNIL\r\nNIL\r\n1\r\nT\r\nOBSERVER\r\nNIL\r\nI\r\n\r\nBUTTON\r\n91\r\n199\r\n153\r\n232\r\nDown\r\nNIL\r\nNIL\r\n1\r\nT\r\nOBSERVER\r\nNIL\r\nK\r\n\r\nBUTTON\r\n153\r\n166\r\n215\r\n199\r\nRight\r\nNIL\r\nNIL\r\n1\r\nT\r\nOBSERVER\r\nNIL\r\nL\r\n\r\nBUTTON\r\n29\r\n166\r\n91\r\n199\r\nLeft\r\nNIL\r\nNIL\r\n1\r\nT\r\nOBSERVER\r\nNIL\r\nJ\r\n\r\nSLIDER\r\n3\r\n95\r\n153\r\n128\r\nstep-size\r\nstep-size\r\n1.0\r\n5.0\r\n1\r\n1.0\r\n1\r\nNIL\r\nHORIZONTAL\r\n\r\nMONITOR\r\n156\r\n10\r\n243\r\n59\r\nLocated at:\r\nNIL\r\n3\r\n1\r\n\r\nMONITOR\r\n3\r\n10\r\n153\r\n59\r\nYou are a:\r\nNIL\r\n3\r\n1\r\n\r\nMONITOR\r\n156\r\n79\r\n243\r\n128\r\nSick?\r\nNIL\r\n3\r\n1\r\n\r\nBUTTON\r\n3\r\n57\r\n153\r\n90\r\nChange Appearance\r\nNIL\r\nNIL\r\n1\r\nT\r\nOBSERVER\r\nNIL\r\nNIL\r\n\r\n@#$#@#$#@\r\ndefault\r\n0.0\r\n-0.2 0 0.0 1.0\r\n0.0 1 1.0 0.0\r\n0.2 0 0.0 1.0\r\nlink direction\r\ntrue\r\n0\r\nLine -7500403 true 150 150 90 180\r\nLine -7500403 true 150 150 210 180\r\n@#$#@#$#@\r\n0\r\n@#$#@#$#@"
, "type": "hubnet-web"
, "version": "hnw-alpha-1"
}
